{"contract_version":"0.2","files":[{"content":"print('Hello from cA-1.0-pro')\n","path":"main.py"}],"language":"python","model_version":"cA-1.0-pro","policy_pack_id":"cA-pro","policy_pack_version":"1.0","run":{"input_hash":"d7d159801a5aa38834dbda24c166fd308d213d499ff49dba7c1ed2733741c30a"},"schema_version":"1.0","type":"code"}
